{
  "section_id": "SG-MA-PHARMACY-INTERNS",
  "content_version": 2,
  "content_hash": "8084f5ceedfa32ca5401b9bb75c02f0d349d0af49e025b910929ecd6797b1a7e",
  "title": "Massachusetts Pharmacy Internship: Hours, Supervision, and the Examination Bar",
  "areas": [
    1
  ],
  "topic": "Pharmacy personnel / Massachusetts pharmacy interns under 247 CMR 8.01",
  "subtopic": "Internship credit and its composition, direct preceptor supervision and its limits, the entry route each class of graduate must clear, and the conduct that bars examination",
  "learning_objectives": [
    "State the internship hour requirement with its internal 1000-hour and 500-hour composition, and name the alternative experiential pathway that reaches the same 1500-hour total.",
    "Apply the daily credit ceiling, keep it apart from the separate limit on hours of practice in any 24-hour period, and distinguish time spent at a site from hours creditable toward the internship requirement.",
    "Identify who may directly supervise a pharmacy intern, how many interns one preceptor may supervise at one time, and what a supervised intern may in turn supervise.",
    "Trace the entry route for a domestic graduate, a PharmD graduate entering a Massachusetts residency, and a graduate of a non-approved college or school of pharmacy.",
    "Name who decides whether a school programme or out-of-state experience counts toward the internship, and on what submission.",
    "State the reporting duties that sit on the intern personally and the consequence the regulation attaches to intern misconduct."
  ],
  "rule_ids": [
    "MA-INTERN-12H",
    "MA-INTERN-SUPERVISION",
    "MA-INTERN-HOUR-COMPOSITION",
    "MA-INTERN-PROGRAM-CREDIT-APPROVAL",
    "MA-INTERN-WITHDRAWAL-NOTICE",
    "MA-INTERN-EXAM-BAR",
    "MA-FOREIGN-GRADUATE-INTERNSHIP",
    "MA-PRECEPTOR-INTERN-RATIO",
    "MA-PHARMD-RESIDENCY-CREDENTIAL",
    "MA-PRACTICE-HOUR-CEILING",
    "MA-PRECEPTOR-DEFINITIONS",
    "MA-PROTECTED-HEALTH-CARE-LICENSURE"
  ],
  "verified_rule_dependencies": {
    "MA-INTERN-12H": {
      "content_version": 1,
      "content_hash": "4fb448f23dde28e34e9239d6a7fe5fee97ec6315d4982cdd41755f170df4ea39"
    },
    "MA-INTERN-SUPERVISION": {
      "content_version": 1,
      "content_hash": "0278d26b4a77ff956db342d9089dc3de34ee96f49e3bea30bf17f7caddee2cc6"
    },
    "MA-INTERN-HOUR-COMPOSITION": {
      "content_version": 1,
      "content_hash": "086568a3df091a8dbf55634463209f844bb28df2e9fa776135da0b1732440855"
    },
    "MA-INTERN-PROGRAM-CREDIT-APPROVAL": {
      "content_version": 1,
      "content_hash": "98ba27b6f707d4cc20056617e92f3790a10e49eaff05ef5b0519b4beba3a09d3"
    },
    "MA-INTERN-WITHDRAWAL-NOTICE": {
      "content_version": 1,
      "content_hash": "95ed3e35904268a8ea21c0724ab11d2f4ea2b559bd4402130a5a3ed4b3690301"
    },
    "MA-INTERN-EXAM-BAR": {
      "content_version": 1,
      "content_hash": "2ccfadbae5301e059dffc72af3ac6663591ec5ba95cb1ad26dbd2f27ac1123a7"
    },
    "MA-FOREIGN-GRADUATE-INTERNSHIP": {
      "content_version": 1,
      "content_hash": "92c75e03654bfd045d7634d7d49ebaeea2d5d6d28d1a16e33f12025d97817ea7"
    },
    "MA-PRECEPTOR-INTERN-RATIO": {
      "content_version": 1,
      "content_hash": "4524c1400fa6fb669637ef615214add8ee9f70ee806b74c1c813cc3f9c60b26a"
    },
    "MA-PHARMD-RESIDENCY-CREDENTIAL": {
      "content_version": 1,
      "content_hash": "343a7a2f52d7b266a978e6ea827c41055be47cd997fbdb5112c515be310f5cb3"
    },
    "MA-PRACTICE-HOUR-CEILING": {
      "content_version": 1,
      "content_hash": "9069d2d75fe6ef96b3ccf24cc15f67353f06e7a659f1253ac79bc5a1e58e91ac"
    },
    "MA-PRECEPTOR-DEFINITIONS": {
      "content_version": 1,
      "content_hash": "cb66d62f2bd41f587a7eface318e0063802eb3a707445a72b0d6954bfddb2d90"
    },
    "MA-PROTECTED-HEALTH-CARE-LICENSURE": {
      "content_version": 1,
      "content_hash": "e031546f05c138d921fad635fcca05e7bfbd932df45bb7d672144b4e51f0e757"
    }
  },
  "orientation": [
    {
      "text": "A Massachusetts pharmacy internship is the supervised practice a candidate must have completed before the Commonwealth will license that candidate as a pharmacist, and 247 CMR 8.01(1) states the requirement in hours rather than in years or job titles. The first pathway is at least 1500 hours of Board-approved pharmacy internship experience, and those 1500 hours are not undifferentiated: at least 1000 of them must be acquired in a pharmacy or pharmacy-related setting approved by the Board, and at least 500 in any one, or any combination, of Board-approved internships in clinical pharmacy, a demonstration project, manufacturing, or analytical or industrial pharmacy. The second pathway reaches the same total by a different route, at least 1500 intern hours acquired through experiential pharmacy education, and it is available where the student is a graduate of an ACPE-accredited college or university. Reading 1500 as a single undivided number is the most common way to misstate this requirement.",
      "rule_ids": [
        "MA-INTERN-HOUR-COMPOSITION"
      ]
    },
    {
      "text": "Supervision is the spine of the whole area. 247 CMR 8.01(3) provides that a pharmacy intern shall work under the direct supervision of a registered pharmacist preceptor, and both halves of that phrase are defined terms. Under 247 CMR 2.00 a preceptor is a registered pharmacist in good standing who has completed at least one year of the actual practice of pharmacy and whom the Board has approved to supervise and direct the training of pharmacy interns, so a pharmacist with less than a year of actual practice, one who is not in good standing, or one the Board has not approved is not a preceptor, however willing. Direct supervision of an intern is the supervision a Board-approved registered pharmacist preceptor gives by overseeing and directing the intern's professional activities, and it includes directly reviewing the intern's work, so being in the building is not the whole of it. The same definitions let a pharmacy intern engage in the full range of activities conducted by a registered pharmacist, provided that at all times the intern is under the direct supervision of a registered pharmacist preceptor. The requirement carries no hours trigger, so accumulated experience does not convert itself into an authority to work alone; an intern who has logged 1400 hours stands in the same supervisory position as one who has logged 40. The obligation is written on the intern, but it describes a relationship, and the preceptor side of that relationship carries its own limit: under 247 CMR 8.01(16) a registered pharmacist preceptor shall not directly supervise more than two pharmacy interns at one time. That cap counts interns and stands independently of the general support-personnel supervisory ratio in 247 CMR 8.06(3), so headroom under one limit does not create headroom under the other. Within the supervised relationship the intern is not merely passive: 247 CMR 8.01(15) allows a pharmacy intern acting under the direct supervision of a registered preceptor to supervise pharmacy technicians, and the intern's own supervised status is the condition of that authority rather than an obstacle to it.",
      "rule_ids": [
        "MA-INTERN-SUPERVISION",
        "MA-PRECEPTOR-DEFINITIONS",
        "MA-PRECEPTOR-INTERN-RATIO"
      ]
    },
    {
      "text": "Hours are earned day by day, and two different 12-hour limits bear on the day. The first is a limit on credit: 247 CMR 8.01(4) provides that a pharmacy intern may not receive more than 12 hours of pharmacy internship credit per day, which makes the record of creditable hours a different document from the record of time spent at a site. The second is a limit on practice itself, and it sits in 247 CMR 9.01(17): a pharmacist, pharmacy intern, or pharmacy technician may not practice in a pharmacy for more than 12 hours in a 24 hour period without completing an eight consecutive hour rest period prior to resuming work in a pharmacy. Only an extenuating circumstance lets the intern exceed 12 hours, in order to act in the best interest of the patient, and then only if the time in excess of 12 hours is minimized and the licensee documents the extenuating circumstance. The practice limit counts time practising in a pharmacy, not every hour spent on the premises. A long intern shift is therefore a practice question before it is a credit question, and even excess time worked lawfully under that exception does not lift the day's credit above 12 hours. Which hours count is also not left to the site or the school. Under 247 CMR 8.01(12) Massachusetts approved colleges and schools of pharmacy shall submit to the Board a written description of each demonstration project or clinical pharmacy program for which pharmacy internship credit is desired, and the Board may determine whether student participation in those projects or programs may be credited to the internship requirement: the school proposes and the Board decides. The Board in turn issues, under 247 CMR 8.01(13), a Summary of Objectives and Procedures for Pharmacy Internship together with guidelines for registered pharmacist preceptors and pharmacy interns. Experience acquired elsewhere is not simply lost either: 247 CMR 8.01(11) allows the Board to grant credit for out-of-state pharmacy internship experience where an affidavit or certificate of approval issued by the jurisdiction in which the experience was acquired is presented to the Board indicating that the experience was duly approved there.",
      "rule_ids": [
        "MA-INTERN-12H",
        "MA-PRACTICE-HOUR-CEILING",
        "MA-INTERN-PROGRAM-CREDIT-APPROVAL",
        "MA-INTERN-HOUR-COMPOSITION"
      ]
    },
    {